{
  "schemaVersion": "1.0",
  "status": "advisory",
  "scope": "framework-source",
  "manifestKind": "context-tier-manifest",
  "tiers": {
    "always": [
      {
        "path": ".lazy-harness/spec/platform/search-read-debt-contract.md",
        "kind": "record",
        "reason": "Defines required-read and non-canonical context behavior.",
        "posture": "required-hint"
      },
      {
        "path": ".lazy-harness/spec/platform/project-profile.md",
        "kind": "record",
        "reason": "Defines Project Profile and feature-navigation retrieval source rules.",
        "posture": "optional-hint"
      }
    ],
    "phase": [
      {
        "id": "context-tier-contract",
        "appliesWhen": [
          "Changing context tier manifest schema, fixture, or pointer audit behavior."
        ],
        "entries": [
          {
            "path": ".lazy-harness/spec/platform/context-tier-manifest.md",
            "kind": "record",
            "reason": "Owns context tier manifest semantics and pointer audit rules.",
            "posture": "required-hint"
          }
        ]
      }
    ],
    "task": [
      {
        "id": "context-delivery-indexing",
        "appliesWhen": [
          "Changing record-index, context-delivery, feature navigation, or tier manifests."
        ],
        "entries": [
          {
            "path": ".lazy-harness/scripts/record-index.ts",
            "kind": "source-file",
            "reason": "Derived record index builder and projectProfile parser.",
            "posture": "validation-hint"
          },
          {
            "path": ".lazy-harness/scripts/self-test.py",
            "kind": "test",
            "reason": "Framework regression coverage for search/read-debt fixtures.",
            "posture": "validation-hint"
          }
        ]
      }
    ],
    "optional": [
      {
        "path": ".lazy-harness/spec/platform/record-digest-format.md",
        "kind": "record",
        "reason": "Defines compact record digest metadata used by retrieval helpers.",
        "posture": "optional-hint"
      }
    ]
  },
  "notes": [
    "This sample is a schema fixture, not runtime semantic authority.",
    "Runtime hooks must ignore context tiers unless a future record explicitly adds a consumer."
  ]
}
